Product Name,Product Features,Target Audience
Eco-Friendly Water Bottle,"BPA-free, Insulated, Reusable, Leak-proof","Eco-conscious consumers, Athletes"
Wireless Bluetooth Headphones,"Noise Cancelling, Bluetooth 5.0, Long Battery Life","Music lovers, Commuters"
Organic Cotton T-Shirt,"100% Organic Cotton, Breathable, Durable","Eco-friendly shoppers, Casual wearers"
Smart LED Bulb,"Wi-Fi Enabled, Dimmable, Energy Efficient","Tech enthusiasts, Homeowners"
Portable Solar Charger,"Compact, Fast Charging, Durable","Outdoor adventurers, Travelers"
Luxury Leather Wallet,"Genuine Leather, RFID Blocking, Compact Design","Professionals, Gift seekers"
Stainless Steel Cookware Set,"Non-Stick, Durable, Oven Safe","Home chefs, Culinary enthusiasts"
Fitness Tracker,"Heart Rate Monitor, Sleep Tracking, Waterproof","Fitness enthusiasts, Health-conscious individuals"
Ergonomic Office Chair,"Adjustable, Lumbar Support, Mesh Back","Office workers, Remote employees"
Drone Camera,"4K Camera, GPS, Long Battery Life","Photography enthusiasts, Tech-savvy users"
Smart Home Assistant,"Voice Recognition, Smart Integration, Compact Design","Homeowners, Tech enthusiasts"
VR Headset,"Immersive Display, 6DOF Tracking, Comfortable Fit","Gamers, Tech adventurers"
Smartwatch,"Heart Rate Monitoring, GPS, Waterproof, Customizable Bands","Fitness enthusiasts, Tech-savvy individuals"
Drone with AI Tracking,"4K Video, Autonomous Follow Mode, Obstacle Avoidance","Outdoor enthusiasts, Adventurers"
Portable Projector,"High Resolution, Compact, Battery Powered","Business professionals, Home entertainers"
Robot Vacuum Cleaner,"Self-Charging, Automated Cleaning, Smart Mapping","Homeowners, Busy professionals"
Wireless Charging Pad,"Fast Charging, Multi-device Compatibility, Sleek Design","Tech enthusiasts, Smartphone users"
Smart Glasses,"Augmented Reality, Lightweight, Bluetooth Connectivity","Early adopters, Tech fans"
Smart Thermostat,"Energy Saving, Remote Control, Voice Command Enabled","Homeowners, Eco-conscious individuals"
Action Camera,"4K Recording, Waterproof, Wide Angle Lens","Adventure seekers, Sports enthusiasts"